{
  "$schema": "https://json-schema.org/draft/2020-12/schema",
  "$id": "https://astramem.dev/contracts/retrieval-result.v1.schema.json",
  "title": "astramem-retrieval@1 result envelope",
  "description": "Result envelope for the shared retrieval contract (ADR-005). Required core = what EVERY implementation can produce; optional fields = best-effort enrichment (cloud fills more than local today). additionalProperties stays FALSE everywhere: a closed schema with declared optionals gives extensibility AND drift detection. An open schema would legalise the silent divergence that white-paged the cloud dashboard three times. Widened 2026-07-13 (CONTRACT-FREEZE, astragenie/memory#759) to carry cloud's full 15-field hit shape as declared optionals — no field is dropped on either side (see the cloud field-mapping table in the freeze doc).",
  "type": "object",
  "additionalProperties": false,
  "properties": {
    "schema": {
      "const": "astramem-retrieval-result@1"
    },
    "query": {
      "type": "object",
      "description": "Echo of the originating query, for trace correlation. Cloud's top-level `mode` moves here.",
      "additionalProperties": false,
      "properties": {
        "text": { "type": "string" },
        "mode": { "type": "string", "enum": ["keyword", "semantic", "hybrid"] }
      }
    },
    "hits": {
      "type": "array",
      "items": {
        "type": "object",
        "additionalProperties": false,
        "required": ["id", "type", "text", "score", "explanation"],
        "properties": {
          "id": { "type": "string", "format": "uuid" },
          "type": {
            "type": "string",
            "description": "Same 10-value union as atom.v1/v2 `type` (ADR D4). Widened from the original 7 (2026-07-09): preference/task_result/summary were missing even though cloud already returns them — a conformant hit from a real cloud response used to fail this schema.",
            "enum": ["decision", "fact", "lesson", "command", "todo", "note", "event", "preference", "task_result", "summary"]
          },
          "text": { "type": "string" },
          "score": {
            "type": "number",
            "description": "Final fused score."
          },
          "scope": {
            "type": "string",
            "description": "ADR-009 memory scope. private|team|org only. atom@2 cut (2026-07-09): the 'personal' alias tracked as TODO(remove-personal-alias) (astramem-local#115) is dropped from this result enum in the same breaking window.",
            "enum": ["private", "team", "org"]
          },
          "explanation": {
            "type": "object",
            "description": "ScoreExplanation (ADR-005): per-signal raw score, weight, and contribution to the final score.",
            "additionalProperties": false,
            "required": ["final", "signals"],
            "properties": {
              "final": {
                "type": "number",
                "description": "Sum of all signal contributions; matches the hit's top-level `score`."
              },
              "signals": {
                "type": "object",
                "description": "Open map keyed by signal name (e.g. bm25, cosine, importance, freshness, usefulness locally; cloud's vector/keyword/importance/recency/usage, including RRF/cross-encoder signals, both validate here).",
                "additionalProperties": {
                  "type": "object",
                  "additionalProperties": false,
                  "required": ["raw", "weight", "final"],
                  "properties": {
                    "raw": { "type": "number" },
                    "weight": { "type": "number" },
                    "final": { "type": "number" }
                  }
                }
              },
              "reason": {
                "type": "string",
                "description": "OPTIONAL (added 2026-07-13, CONTRACT-FREEZE §2). Human-readable summary. Cloud already emits this (ScoreExplanationDto.reason) and had nowhere to put it under a closed schema; local does not generate one today and omits the key rather than fake it."
              },
              "top_signal": {
                "type": "string",
                "description": "OPTIONAL (FEAT-500, added 2026-07-14). Argmax of `signals` by `.final` — the single signal name that contributed the most to this hit's fused score (Mnemon's `via` equivalent). Deterministic tie-break: alphabetical by signal name."
              }
            }
          },

          "importance": {
            "type": "number", "minimum": 0, "maximum": 1,
            "description": "OPTIONAL (added 2026-07-13). Local already stores this (atom@2 requires it) and was projecting it away."
          },
          "confidence": {
            "type": "number", "minimum": 0, "maximum": 1,
            "description": "OPTIONAL (added 2026-07-13). Cloud's `confidence_score`. Local already stores this (atom@2 requires it)."
          },
          "created_at": {
            "type": "string", "format": "date-time",
            "description": "OPTIONAL (added 2026-07-13). Local already stores this (atom@2 requires it)."
          },
          "source": {
            "type": "string",
            "description": "OPTIONAL (added 2026-07-13). Origin of the memory. Maps to local's `memories.capture_source` column (migration 024)."
          },
          "tags": {
            "type": "array", "items": { "type": "string" },
            "description": "OPTIONAL (added 2026-07-13). Cloud only today — local has no tags column, omits the key rather than fake it."
          },
          "usage_count": {
            "type": "integer", "minimum": 0,
            "description": "OPTIONAL (added 2026-07-13). Cloud only today — local has no usage_count column, omits the key rather than fake it."
          },
          "metadata": {
            "type": ["object", "null"],
            "description": "OPTIONAL (added 2026-07-13). Free-form; the one place an open map is intentional. Nullable: cloud emits `\"metadata\": null` for a memory with none, rather than omitting the key — caught by validating a LIVE cloud response against this schema, not a fixture. Same nullable treatment as `embedding_error`.",
            "additionalProperties": true
          },
          "highlights": {
            "type": "array",
            "description": "OPTIONAL (added 2026-07-13). Cloud's `content_preview_highlights` — character ranges into `text`, plus the matched term. Shape mirrors cloud's long-standing HighlightRangeDto {start, end, term} — the freeze doc originally said {start, length}, which was invented rather than checked against the real DTO. Local has no FTS snippet extraction yet and omits the key rather than fake it.",
            "items": {
              "type": "object",
              "additionalProperties": false,
              "required": ["start", "end"],
              "properties": {
                "start": { "type": "integer", "minimum": 0 },
                "end": { "type": "integer", "minimum": 0 },
                "term": { "type": "string" }
              }
            }
          }
        }
      }
    },
    "total": {
      "type": "integer",
      "minimum": 0
    },

    "embedding_error": {
      "type": ["string", "null"],
      "description": "OPTIONAL (added 2026-07-13, CONTRACT-FREEZE §4.3). Non-null when the embedding provider failed and the result is DEGRADED (keyword-only). Cloud emits this today and it must not be lost — a silently degraded search is the worst failure mode for a memory product. Local's search() already has an equivalent internal fallback (vector search try/catch in search.ts) but does not yet surface the failure reason on the wire — tracked as a follow-up, not implemented in this slice."
    },
    "search_log_id": {
      "type": "string", "format": "uuid",
      "description": "OPTIONAL (added 2026-07-13). Trace correlation handle."
    }
  },
  "required": ["schema", "hits"]
}
